{
  "schema": "zigapagos.rails-presentation/1",
  "schema_version": 1,
  "generator": {
    "tool": "zigapagos",
    "version": "v0.5.0"
  },
  "source": {
    "framework": "rails",
    "version": {
      "value": "7.2.1",
      "evidence": "Gemfile.lock:rails (7.2.1)"
    },
    "root_evidence": [
      "config/application.rb",
      "config/routes.rb",
      "app/views",
      "Gemfile"
    ]
  },
  "discovery": {
    "route_mode": "static_ast",
    "ruby": {
      "available": true,
      "version": "4.0.1"
    }
  },
  "routes": [
    {
      "id": "GET /",
      "verb": "GET",
      "path": "/",
      "controller": "pages",
      "action": "about",
      "name": "root",
      "source": {
        "file": "config/routes.rb",
        "line": 5
      },
      "origin": "static_ast",
      "confidence": "certain",
      "classification": "unresolved",
      "reason": "the resolved layout reads request-time state",
      "candidates": [],
      "templates": [
        "app/views/pages/about.html.erb",
        "app/views/shared/_nav.html.erb"
      ],
      "layout": "app/views/layouts/marketing.html.erb"
    },
    {
      "id": "GET /about",
      "verb": "GET",
      "path": "/about",
      "controller": "pages",
      "action": "about",
      "name": "about",
      "source": {
        "file": "config/routes.rb",
        "line": 6
      },
      "origin": "static_ast",
      "confidence": "certain",
      "classification": "unresolved",
      "reason": "the resolved layout reads request-time state",
      "candidates": [],
      "templates": [
        "app/views/pages/about.html.erb",
        "app/views/shared/_nav.html.erb"
      ],
      "layout": "app/views/layouts/marketing.html.erb"
    },
    {
      "id": "GET /broken",
      "verb": "GET",
      "path": "/broken",
      "controller": "pages",
      "action": "broken",
      "name": "broken",
      "source": {
        "file": "config/routes.rb",
        "line": 54
      },
      "origin": "static_ast",
      "confidence": "certain",
      "classification": "unresolved",
      "reason": "the resolved layout reads request-time state",
      "candidates": [],
      "templates": [
        "app/views/pages/broken.html.erb",
        "app/views/shared/_nav.html.erb"
      ],
      "layout": "app/views/layouts/marketing.html.erb"
    },
    {
      "id": "GET /feed",
      "verb": "GET",
      "path": "/feed",
      "controller": "posts",
      "action": "feed",
      "name": "feed",
      "source": {
        "file": "config/routes.rb",
        "line": 20
      },
      "origin": "static_ast",
      "confidence": "certain",
      "classification": "backend",
      "reason": "action renders JSON, not a view",
      "candidates": [],
      "templates": [],
      "layout": null
    },
    {
      "id": "GET /help",
      "verb": "GET",
      "path": "/help",
      "controller": "pages",
      "action": "help",
      "name": "help",
      "source": {
        "file": "config/routes.rb",
        "line": 9
      },
      "origin": "static_ast",
      "confidence": "certain",
      "classification": "unresolved",
      "reason": "the resolved layout reads request-time state",
      "candidates": [],
      "templates": [
        "app/views/pages/help.html.erb",
        "app/views/shared/_nav.html.erb"
      ],
      "layout": "app/views/layouts/marketing.html.erb"
    },
    {
      "id": "GET /linked",
      "verb": "GET",
      "path": "/linked",
      "controller": "pages",
      "action": "linked",
      "name": "linked",
      "source": {
        "file": "config/routes.rb",
        "line": 61
      },
      "origin": "static_ast",
      "confidence": "certain",
      "classification": "unresolved",
      "reason": "the resolved layout reads request-time state",
      "candidates": [],
      "templates": [
        "app/views/pages/linked.html.erb",
        "app/views/shared/_nav.html.erb"
      ],
      "layout": "app/views/layouts/marketing.html.erb"
    },
    {
      "id": "GET /links",
      "verb": "GET",
      "path": "/links",
      "controller": "pages",
      "action": "links",
      "name": "links",
      "source": {
        "file": "config/routes.rb",
        "line": 55
      },
      "origin": "static_ast",
      "confidence": "certain",
      "classification": "unresolved",
      "reason": "the resolved layout reads request-time state",
      "candidates": [],
      "templates": [
        "app/views/pages/links.html.erb",
        "app/views/shared/_nav.html.erb"
      ],
      "layout": "app/views/layouts/marketing.html.erb"
    },
    {
      "id": "GET /live",
      "verb": "GET",
      "path": "/live",
      "controller": "pages",
      "action": "live",
      "name": "live",
      "source": {
        "file": "config/routes.rb",
        "line": 65
      },
      "origin": "static_ast",
      "confidence": "certain",
      "classification": "unresolved",
      "reason": "the resolved layout reads request-time state",
      "candidates": [],
      "templates": [
        "app/views/pages/live.html.erb",
        "app/views/shared/_nav.html.erb"
      ],
      "layout": "app/views/layouts/marketing.html.erb"
    },
    {
      "id": "GET /old",
      "verb": "GET",
      "path": "/old",
      "controller": "pages",
      "action": "old",
      "name": "old",
      "source": {
        "file": "config/routes.rb",
        "line": 53
      },
      "origin": "static_ast",
      "confidence": "certain",
      "classification": "redirect",
      "reason": "controller action only issues a redirect",
      "candidates": [],
      "templates": [],
      "layout": null
    },
    {
      "id": "GET /posts",
      "verb": "GET",
      "path": "/posts",
      "controller": "posts",
      "action": "index",
      "name": "posts",
      "source": {
        "file": "config/routes.rb",
        "line": 14
      },
      "origin": "static_ast",
      "confidence": "certain",
      "classification": "unresolved",
      "reason": "the resolved layout reads request-time state",
      "candidates": [],
      "templates": [
        "app/views/posts/_post.html.erb",
        "app/views/posts/index.html.erb",
        "app/views/shared/_nav.html.erb"
      ],
      "layout": "app/views/layouts/application.html.erb"
    },
    {
      "id": "POST /posts",
      "verb": "POST",
      "path": "/posts",
      "controller": "posts",
      "action": "create",
      "name": "posts",
      "source": {
        "file": "config/routes.rb",
        "line": 14
      },
      "origin": "static_ast",
      "confidence": "certain",
      "classification": "backend",
      "reason": "non-GET verb is a backend responsibility",
      "candidates": [],
      "templates": [],
      "layout": null
    },
    {
      "id": "GET /posts/:id",
      "verb": "GET",
      "path": "/posts/:id",
      "controller": "posts",
      "action": "show",
      "name": "post",
      "source": {
        "file": "config/routes.rb",
        "line": 14
      },
      "origin": "static_ast",
      "confidence": "certain",
      "classification": "unresolved",
      "reason": "the resolved layout reads request-time state",
      "candidates": [],
      "templates": [
        "app/views/posts/show.html.erb",
        "app/views/shared/_nav.html.erb"
      ],
      "layout": "app/views/layouts/application.html.erb"
    },
    {
      "id": "GET /posts/legacy",
      "verb": "GET",
      "path": "/posts/legacy",
      "controller": "posts",
      "action": "legacy",
      "name": "posts_legacy",
      "source": {
        "file": "config/routes.rb",
        "line": 25
      },
      "origin": "static_ast",
      "confidence": "certain",
      "classification": "unresolved",
      "reason": "unsupported template engine, never converted",
      "candidates": [],
      "templates": [
        "app/views/posts/legacy.html.haml",
        "app/views/shared/_nav.html.erb"
      ],
      "layout": "app/views/layouts/application.html.erb"
    },
    {
      "id": "GET /posts/new",
      "verb": "GET",
      "path": "/posts/new",
      "controller": "posts",
      "action": "new",
      "name": "new_post",
      "source": {
        "file": "config/routes.rb",
        "line": 14
      },
      "origin": "static_ast",
      "confidence": "certain",
      "classification": "unresolved",
      "reason": "the resolved layout reads request-time state",
      "candidates": [],
      "templates": [
        "app/views/posts/new.html.erb",
        "app/views/shared/_nav.html.erb"
      ],
      "layout": "app/views/layouts/application.html.erb"
    },
    {
      "id": "POST /registration",
      "verb": "POST",
      "path": "/registration",
      "controller": "registrations",
      "action": "create",
      "name": "registration",
      "source": {
        "file": "config/routes.rb",
        "line": 42
      },
      "origin": "static_ast",
      "confidence": "certain",
      "classification": "backend",
      "reason": "non-GET verb is a backend responsibility",
      "candidates": [],
      "templates": [],
      "layout": null
    },
    {
      "id": "GET /registration/new",
      "verb": "GET",
      "path": "/registration/new",
      "controller": "registrations",
      "action": "new",
      "name": "new_registration",
      "source": {
        "file": "config/routes.rb",
        "line": 42
      },
      "origin": "static_ast",
      "confidence": "certain",
      "classification": "unresolved",
      "reason": "the resolved layout reads request-time state",
      "candidates": [],
      "templates": [
        "app/views/registrations/new.html.erb",
        "app/views/shared/_nav.html.erb"
      ],
      "layout": "app/views/layouts/application.html.erb"
    },
    {
      "id": "DELETE /session",
      "verb": "DELETE",
      "path": "/session",
      "controller": "sessions",
      "action": "destroy",
      "name": "session",
      "source": {
        "file": "config/routes.rb",
        "line": 38
      },